{
  "deployed_commit": "aaaaaaaaaaaaaaaaaaaaaaaaaaaaaaaaaaaaaaaa",
  "host_id_sha256": "1111111111111111111111111111111111111111111111111111111111111111",
  "installed_release_tree_sha256": "2222222222222222222222222222222222222222222222222222222222222222",
  "pre_reboot_boot_id_sha256": "3333333333333333333333333333333333333333333333333333333333333333",
  "process_kill": {
    "after_process_sha256": "5555555555555555555555555555555555555555555555555555555555555555",
    "before_process_sha256": "4444444444444444444444444444444444444444444444444444444444444444",
    "killed_at": "2026-08-11T03:50:00Z",
    "recovered": true,
    "recovered_at": "2026-08-11T03:51:00Z",
    "target_service": "remote-mcp"
  },
  "reboot_prepared_at": "2026-08-11T03:52:00Z",
  "schema_version": "my-data-hub-deployment-evidence-state.v1",
  "source_identity": "onedayonemasterpiece/my-data-hub",
  "source_tree_sha256": "2222222222222222222222222222222222222222222222222222222222222222"
}
